{
  "schemaVersion": 1,
  "type": "trivia",
  "name": "Music trivia",
  "questions": [
    {
      "question": "Which artist released the 1982 album Thriller?",
      "choices": [
        "Prince",
        "Michael Jackson",
        "Madonna",
        "Lionel Richie"
      ],
      "answer": 1,
      "source": "https://en.wikipedia.org/wiki/Thriller_(album)"
    },
    {
      "question": "Which band recorded Bohemian Rhapsody?",
      "choices": [
        "Led Zeppelin",
        "Pink Floyd",
        "The Who",
        "Queen"
      ],
      "answer": 3,
      "source": "https://en.wikipedia.org/wiki/Bohemian_Rhapsody"
    },
    {
      "question": "Which band released the album Synchronicity?",
      "choices": [
        "The Police",
        "Duran Duran",
        "Tears for Fears",
        "INXS"
      ],
      "answer": 0,
      "source": "https://en.wikipedia.org/wiki/Synchronicity_(The_Police_album)"
    },
    {
      "question": "Who wrote and first recorded the song Hallelujah in 1984?",
      "choices": [
        "Jeff Buckley",
        "Leonard Cohen",
        "Bob Dylan",
        "Rufus Wainwright"
      ],
      "answer": 1,
      "source": "https://en.wikipedia.org/wiki/Hallelujah_(Leonard_Cohen_song)"
    },
    {
      "question": "Which Beatles album has the band walking across a zebra crossing on its cover?",
      "choices": [
        "Revolver",
        "Help!",
        "Let It Be",
        "Abbey Road"
      ],
      "answer": 3,
      "source": "https://www.udiscovermusic.com/stories/four-beatles-one-zebra-crossing-london-nw8"
    },
    {
      "question": "Purple Rain is a 1984 album by which artist?",
      "choices": [
        "Stevie Wonder",
        "David Bowie",
        "Prince",
        "Michael Jackson"
      ],
      "answer": 2,
      "source": "https://en.wikipedia.org/wiki/Purple_Rain_(album)"
    },
    {
      "question": "Which singer is known as the Queen of Soul?",
      "choices": [
        "Diana Ross",
        "Aretha Franklin",
        "Whitney Houston",
        "Tina Turner"
      ],
      "answer": 1,
      "source": "https://www.ksl.com/article/46376910/queen-of-soul-aretha-franklin-dies-at-76"
    },
    {
      "question": "Which band made the 1977 album Rumours?",
      "choices": [
        "Eagles",
        "ABBA",
        "Fleetwood Mac",
        "Boston"
      ],
      "answer": 2,
      "source": "https://en.wikipedia.org/wiki/Rumours_(album)"
    },
    {
      "question": "In which country was ABBA formed?",
      "choices": [
        "Norway",
        "Sweden",
        "Denmark",
        "Finland"
      ],
      "answer": 1,
      "source": "https://en.wikipedia.org/wiki/ABBA"
    },
    {
      "question": "Which singer released the 2011 album 21?",
      "choices": [
        "Adele",
        "Amy Winehouse",
        "Lady Gaga",
        "Rihanna"
      ],
      "answer": 0,
      "source": "https://en.wikipedia.org/wiki/21_(Adele_album)"
    },
    {
      "question": "Which singer released the 2006 album Back to Black?",
      "choices": [
        "Duffy",
        "Lily Allen",
        "Adele",
        "Amy Winehouse"
      ],
      "answer": 3,
      "source": "https://en.wikipedia.org/wiki/Back_to_Black"
    },
    {
      "question": "Who sang Like a Prayer in 1989?",
      "choices": [
        "Cyndi Lauper",
        "Madonna",
        "Janet Jackson",
        "Whitney Houston"
      ],
      "answer": 1,
      "source": "https://en.wikipedia.org/wiki/Like_a_Prayer_(song)"
    },
    {
      "question": "Which band is fronted by Bono?",
      "choices": [
        "U2",
        "Coldplay",
        "INXS",
        "Simple Minds"
      ],
      "answer": 0,
      "source": "https://en.wikipedia.org/wiki/U2"
    },
    {
      "question": "Which Pink Floyd album shows a prism splitting light on its cover?",
      "choices": [
        "The Wall",
        "Wish You Were Here",
        "The Dark Side of the Moon",
        "Animals"
      ],
      "answer": 2,
      "source": "https://en.wikipedia.org/wiki/The_Dark_Side_of_the_Moon"
    },
    {
      "question": "Which Nirvana album contains Smells Like Teen Spirit?",
      "choices": [
        "In Utero",
        "Nevermind",
        "Bleach",
        "Incesticide"
      ],
      "answer": 1,
      "source": "https://en.wikipedia.org/wiki/Nevermind"
    },
    {
      "question": "In which city was Motown Records founded?",
      "choices": [
        "Memphis",
        "Chicago",
        "Philadelphia",
        "Detroit"
      ],
      "answer": 3,
      "source": "https://en.wikipedia.org/wiki/Motown"
    },
    {
      "question": "Which rapper released The Marshall Mathers LP?",
      "choices": [
        "Eminem",
        "Jay-Z",
        "Nas",
        "Dr. Dre"
      ],
      "answer": 0,
      "source": "https://en.wikipedia.org/wiki/The_Marshall_Mathers_LP"
    },
    {
      "question": "Which pop star was born Stefani Joanne Angelina Germanotta?",
      "choices": [
        "Katy Perry",
        "Lady Gaga",
        "Pink",
        "Kesha"
      ],
      "answer": 1,
      "source": "https://en.wikipedia.org/wiki/Lady_Gaga"
    },
    {
      "question": "Which singer had a 2010 hit with Rolling in the Deep?",
      "choices": [
        "Adele",
        "Beyoncé",
        "Florence Welch",
        "Duffy"
      ],
      "answer": 0,
      "source": "https://en.wikipedia.org/wiki/Rolling_in_the_Deep"
    },
    {
      "question": "Which band had a 1991 hit with Losing My Religion?",
      "choices": [
        "The Cure",
        "R.E.M.",
        "Pearl Jam",
        "Radiohead"
      ],
      "answer": 1,
      "source": "https://en.wikipedia.org/wiki/Losing_My_Religion"
    },
    {
      "question": "Which Beatle wrote Here Comes the Sun?",
      "choices": [
        "John Lennon",
        "Paul McCartney",
        "George Harrison",
        "Ringo Starr"
      ],
      "answer": 2,
      "source": "https://en.wikipedia.org/wiki/Here_Comes_the_Sun"
    },
    {
      "question": "Which artist created the stage persona Ziggy Stardust?",
      "choices": [
        "Elton John",
        "David Bowie",
        "Marc Bolan",
        "Freddie Mercury"
      ],
      "answer": 1,
      "source": "https://en.wikipedia.org/wiki/Ziggy_Stardust_(character)"
    },
    {
      "question": "Which group had a 1996 hit with Wannabe?",
      "choices": [
        "All Saints",
        "TLC",
        "Destiny's Child",
        "Spice Girls"
      ],
      "answer": 3,
      "source": "https://en.wikipedia.org/wiki/Wannabe"
    },
    {
      "question": "Which country is the singer Shakira from?",
      "choices": [
        "Mexico",
        "Colombia",
        "Spain",
        "Argentina"
      ],
      "answer": 1,
      "source": "https://en.wikipedia.org/wiki/Shakira"
    },
    {
      "question": "Which band recorded Smoke on the Water?",
      "choices": [
        "Black Sabbath",
        "Deep Purple",
        "Uriah Heep",
        "Rainbow"
      ],
      "answer": 1,
      "source": "https://en.wikipedia.org/wiki/Smoke_on_the_Water"
    },
    {
      "question": "At Motown 25 in 1983, Michael Jackson first showed the moonwalk while performing which song?",
      "choices": [
        "Beat It",
        "Thriller",
        "Billie Jean",
        "Bad"
      ],
      "answer": 2,
      "source": "https://en.wikipedia.org/wiki/Billie_Jean"
    },
    {
      "question": "Where was Freddie Mercury born?",
      "choices": [
        "London",
        "Zanzibar",
        "Mumbai",
        "Cairo"
      ],
      "answer": 1,
      "source": "https://en.wikipedia.org/wiki/Freddie_Mercury"
    },
    {
      "question": "Which band recorded Hotel California?",
      "choices": [
        "Doobie Brothers",
        "Steely Dan",
        "Chicago",
        "Eagles"
      ],
      "answer": 3,
      "source": "https://en.wikipedia.org/wiki/Hotel_California"
    },
    {
      "question": "Who wrote and recorded the song Imagine?",
      "choices": [
        "Paul McCartney",
        "John Lennon",
        "George Harrison",
        "Harry Nilsson"
      ],
      "answer": 1,
      "source": "https://en.wikipedia.org/wiki/Imagine_(John_Lennon_song)"
    },
    {
      "question": "Which Taylor Swift album was released in 2014?",
      "choices": [
        "Red",
        "Reputation",
        "Fearless",
        "1989"
      ],
      "answer": 3,
      "source": "https://en.wikipedia.org/wiki/1989_(Taylor_Swift_album)"
    },
    {
      "question": "Beyoncé first became famous as a member of which group?",
      "choices": [
        "TLC",
        "En Vogue",
        "Destiny's Child",
        "Wilson Phillips"
      ],
      "answer": 2,
      "source": "https://en.wikipedia.org/wiki/Destiny%27s_Child"
    },
    {
      "question": "Which Jamaican singer is best known for No Woman, No Cry?",
      "choices": [
        "Peter Tosh",
        "Jimmy Cliff",
        "Bob Marley",
        "Toots Hibbert"
      ],
      "answer": 2,
      "source": "https://en.wikipedia.org/wiki/No_Woman,_No_Cry"
    },
    {
      "question": "Which singer is nicknamed The Boss?",
      "choices": [
        "Bruce Springsteen",
        "Billy Joel",
        "Jon Bon Jovi",
        "Tom Petty"
      ],
      "answer": 0,
      "source": "https://en.wikipedia.org/wiki/Bruce_Springsteen"
    },
    {
      "question": "Which band recorded Don't Stop Believin'?",
      "choices": [
        "Foreigner",
        "Journey",
        "Toto",
        "Boston"
      ],
      "answer": 1,
      "source": "https://en.wikipedia.org/wiki/Don%27t_Stop_Believin%27"
    },
    {
      "question": "Which producer and songwriter, Billie Eilish's brother, co-wrote her early hits?",
      "choices": [
        "Jack Antonoff",
        "Max Martin",
        "Finneas O'Connell",
        "Pharrell Williams"
      ],
      "answer": 2,
      "source": "https://en.wikipedia.org/wiki/Finneas_O%27Connell"
    },
    {